publishedAt,title,description,article_url
2025-08-20 13:25:00,Nvidia Stock Stumble Shows Why Investors Must Widen Their AI Lens,"Nvidia's recent stock decline highlights the risks of over-concentration in tech stocks, particularly in AI. Investors are advised to diversify their AI investments across sectors and geographies, recognizing that AI opportunities extend beyond a few dominant companies.",https://www.investing.com/analysis/nvidia-stock-stumble-shows-why-investors-must-widen-their-ai-lens-200665602
2025-08-20 12:22:00,Apple: Is the Firm On the Verge of an AI Revolution?,"Apple is planning a strategic AI and robotics push, including a tabletop robot with advanced AI capabilities and smart home products, targeting market launch around 2027 to compete with AI competitors.",https://www.investing.com/analysis/apple-is-the-firm-on-the-verge-of-an-ai-revolution-200665612
2025-08-20 11:23:00,"If You'd Invested $10,000 in Apple Stock 30 Years Ago, Here's How Much You'd Have Today","An analysis of Apple's stock performance over 30 years reveals an incredible investment opportunity, with a $10,000 investment growing to approximately $6.9 million through stock appreciation and dividend reinvestment, highlighting the potential of long-term strategic investing.",https://www.fool.com/investing/2025/08/20/if-youd-invested-10000-in-apple-stock-30-years-ago/?source=iedfolrf0000001
2025-08-20 09:13:00,S&P 500: Is a Bear Market Even Possible?,"The article discusses the potential for a significant bear market in the S&P 500, challenging the current market optimism driven by AI and earnings expectations. The author suggests that human sentiment and market cycles could lead to a prolonged market downturn similar to Japan's extended bear market.",https://www.investing.com/analysis/sp-500-is-a-bear-market-even-possible-200665571
2025-08-20 08:52:00,DIFD AUTO Reveals a New Era of Crypto-Powered Automotive Business,"DIFD AUTO introduces a revolutionary global crypto car purchase program, allowing customers to buy luxury vehicles and electric vehicles using Bitcoin and USDT, with innovative blockchain-based payment solutions and advanced technologies like NFT car keys.",https://www.globenewswire.com/news-release/2025/08/20/3136212/0/en/DIFD-AUTO-Reveals-a-New-Era-of-Crypto-Powered-Automotive-Business.html
2025-08-20 06:38:00,Did Q2 Earnings Exceed Expectations or Get Derailed by Tariffs?,"Q2 earnings season exceeded expectations, with S&P 500 earnings growing 12% versus initial 4.8% estimates. The Magnificent 7 tech stocks led growth, averaging nearly 30% earnings growth and increasing capital expenditure guidance.",https://www.investing.com/analysis/did-q2-earnings-exceed-expectations-or-get-derailed-by-tariffs-200665580
2025-08-20 00:01:00,"Billionaires Are Buying a Popular AI Index Fund That Could Turn $500 Per Month Into Over $500,000","Billionaire investors are increasingly investing in the Invesco QQQ Trust (QQQ), a tech-heavy ETF tracking the Nasdaq-100 index. The fund has historically delivered impressive returns and is well-positioned to benefit from emerging technologies like artificial intelligence.",https://www.fool.com/investing/2025/08/19/billionaires-are-buying-a-popular-ai-index-fund-th/?source=iedfolrf0000001
2025-08-19 20:26:14,Apple's India Production Milestone Could Cushion Earnings Against Tariff Impact,"Apple has achieved a significant milestone by producing all iPhone 17 models in India, potentially mitigating potential tariff impacts and reducing reliance on Chinese manufacturing.",https://www.benzinga.com/markets/tech/25/08/47221403/apples-india-production-milestone-could-cushion-earnings-against-tariff-impact
2025-08-19 20:00:00,"AAPL INVESTOR ALERT: Bronstein, Gewirtz & Grossman LLC Announces that Apple Inc. Investors with Substantial Losses Have Opportunity to Lead Class Action Lawsuit","A class action lawsuit has been filed against Apple alleging false statements about AI-based Siri features for the iPhone 16, potentially misrepresenting the company's technological capabilities and financial prospects.",https://www.globenewswire.com/news-release/2025/08/19/3135993/9788/en/AAPL-INVESTOR-ALERT-Bronstein-Gewirtz-Grossman-LLC-Announces-that-Apple-Inc-Investors-with-Substantial-Losses-Have-Opportunity-to-Lead-Class-Action-Lawsuit.html
2025-08-19 14:15:00,A New Era of Investing: Can These ETFs Outperform the Market?,"Two ETFs, Vanguard Growth and Invesco QQQ, show strong market-beating potential by investing in leading tech companies with significant cloud computing, AI infrastructure, and digital ecosystem dominance.",https://www.fool.com/investing/2025/08/19/a-new-era-of-investing-can-these-etfs-outperform/?source=iedfolrf0000001
2025-08-19 11:30:00,8 Bullish Technical Setups Flashing Strong Buy Signals Today,"The article discusses using Investing.com's 'Technical Titans' stock screener to identify high-potential stocks with strong technical indicators, focusing on stocks with MACD above 0 and market capitalization over $2 billion.",https://www.investing.com/analysis/8-bullish-technical-setups-flashing-strong-buy-signals-today-200665507
2025-08-19 08:20:00,Here's Why Berkshire Hathaway Stock Is a Buy Before November,"Berkshire Hathaway's stock has underperformed the S&P 500 in the past year, with challenges including Warren Buffett's upcoming retirement and conservative investment strategies. Despite these concerns, the company remains fundamentally strong with potential for continued growth.",https://www.fool.com/investing/2025/08/19/why-berkshire-hathaway-stock-buy-before-november/?source=iedfolrf0000001
2025-08-19 08:04:00,"Billionaires Buy a Brilliant Vanguard Index Fund That Could Turn $500 Per Month Into $442,400 With Help From the ""Magnificent Seven"" Stocks","The Vanguard Mega Cap Growth ETF offers significant investment potential, with nearly 60% of assets in 'Magnificent Seven' stocks. The fund has historically returned 669% since inception and could potentially turn $500 monthly investments into $442,400 over 20 years.",https://www.fool.com/investing/2025/08/19/billionaires-buy-vanguard-index-fund-500-to-442400/?source=iedfolrf0000001
2025-08-19 07:02:00,"Prediction: This Unstoppable Stock Will Join Nvidia, Microsoft, Apple, Amazon, and Alphabet in the $2 Trillion Club by 2028","Taiwan Semiconductor (TSMC) is predicted to reach a $2 trillion market cap by 2028, driven by its pivotal role in the AI semiconductor industry and strong revenue growth in high-performance computing.",https://www.fool.com/investing/2025/08/19/predition-unstoppable-stock-that-could-join-nvidia/?source=iedfolrf0000001
2025-08-19 01:30:00,Wireless Audio Devices Industry Poised for $70.9 Billion Market Boom by 2029,"The Wireless Audio Device Market is expected to grow from $56.5 billion in 2024 to $70.9 billion by 2029, with a 4.7% CAGR. Growth is driven by increasing demand for portable, high-quality audio solutions across consumer, home audio, and automotive applications.",https://www.globenewswire.com/news-release/2025/08/19/3135385/0/en/Wireless-Audio-Devices-Industry-Poised-for-70-9-Billion-Market-Boom-by-2029.html
2025-08-18 20:13:00,S&P 500 Record Surge: Earnings Momentum Meets Market Realities,"The S&P 500 reached a record high of 6,468 in 2025, driven by strong Q2 earnings growth of 11.8% and positive corporate guidance. Tech sector and Magnificent 7 companies led the surge, with earnings momentum shifting from multiple expansion to fundamental growth.",https://www.investing.com/analysis/sp-500-record-surge-earnings-momentum-meets-market-realities-200665483
2025-08-18 18:45:00,Apache Software Foundation Announces Keynote Speakers for Community Over Code North America,"The Apache Software Foundation will host Community Over Code North America in Minneapolis from September 11-14, 2025, featuring keynotes and sessions on AI, security, data protection, and open source innovation.",https://www.globenewswire.com/news-release/2025/08/18/3135247/17401/en/Apache-Software-Foundation-Announces-Keynote-Speakers-for-Community-Over-Code-North-America.html
2025-08-18 15:32:02,Corporate America Is Crushing All Estimates – But Magnificent Seven Still Run The Show,"Q2 2025 earnings season shows strong corporate performance, with 60% of S&P 500 companies beating estimates. The Magnificent Seven tech stocks significantly outperformed the rest of the index, growing earnings 3 times faster than other companies.",https://www.benzinga.com/markets/large-cap/25/08/47189323/sp-500-earnings-magnificent-seven-performance
2025-08-18 14:00:00,Circana Reveals 2025 B2B Tech Channel Performance Award Winners at XChange,"Circana, LLC recognized top-performing technology brands across six categories, highlighting market share changes and revenue achievements in the U.S. B2B technology sector for 2025.",https://www.globenewswire.com/news-release/2025/08/18/3135103/0/en/Circana-Reveals-2025-B2B-Tech-Channel-Performance-Award-Winners-at-XChange.html
2025-08-18 09:30:00,"Natural Language Understanding Market to USD 108.2 Billion by 2032, Owing to Surge in Conversational AI Use Across Industries | Report by SNS Insider","The Natural Language Understanding (NLU) market is projected to grow from $21.8 billion in 2024 to $108.2 billion by 2032, driven by AI-powered customer service tools, healthcare digitization, and government AI initiatives.",https://www.globenewswire.com/news-release/2025/08/18/3134854/0/en/Natural-Language-Understanding-Market-to-USD-108-2-Billion-by-2032-Owing-to-Surge-in-Conversational-AI-Use-Across-Industries-Report-by-SNS-Insider.html
2025-08-18 08:23:00,"Down 91% From Its Record High, Can Snap Stock Snap Back in 2025?","Snap is developing innovative advertising tools using AI and machine learning to improve ad performance, with a growing daily user base of 469 million. Despite stock challenges since 2021, the company is working to make its platform more attractive to businesses.",https://www.fool.com/investing/2025/08/18/down-91-record-high-can-snap-stock-snap-back-2025/?source=iedfolrf0000001
2025-08-18 01:30:00,1 Brilliant Artificial Intelligence (AI) Stock That Will Be Worth More Than Apple by 2030,"The article argues that Amazon is poised to surpass Apple in market capitalization within five years, driven by strong growth in AWS cloud computing and advertising services, which offer higher profit margins compared to Apple's traditional product sales.",https://www.fool.com/investing/2025/08/17/1-brilliant-artificial-intelligence-ai-stock-that/?source=iedfolrf0000001
2025-08-17 15:23:00,Warren Buffett Is Selling Apple and Bank of America Stock and Piling Into an Embattled Healthcare Stock Down 46% This Year,"Warren Buffett's Berkshire Hathaway reduced stakes in Apple and Bank of America while initiating a $1.57 billion position in UnitedHealth Group, a healthcare stock down 46% this year, potentially seeing value in its market position and future growth.",https://www.fool.com/investing/2025/08/17/warren-buffett-is-selling-apple-and-bank-of-americ/?source=iedfolrf0000001
2025-08-17 13:43:00,Pomerantz Law Firm Announces the Filing of a Class Action Against Apple Inc. and Certain Officers – AAPL,"Pomerantz LLP filed a class action lawsuit against Apple for allegedly misleading investors about advanced AI-based Siri features for iPhone 16, which were not developed as promised, causing stock price declines.",https://www.globenewswire.com/news-release/2025/08/17/3134595/1087/en/Pomerantz-Law-Firm-Announces-the-Filing-of-a-Class-Action-Against-Apple-Inc-and-Certain-Officers-AAPL.html
2025-08-17 11:23:00,AAPL LOSS ALERT: Apple Inc. Investors with Losses are Reminded of the August 19 Class Action Deadline – Contact BFA Law (NASDAQ:AAPL),"Apple faces a class action lawsuit alleging securities fraud related to misrepresentations about Siri's advanced AI features and development timeline, with stock price declining after delayed AI feature announcements.",https://www.globenewswire.com/news-release/2025/08/17/3134590/0/en/AAPL-LOSS-ALERT-Apple-Inc-Investors-with-Losses-are-Reminded-of-the-August-19-Class-Action-Deadline-Contact-BFA-Law-NASDAQ-AAPL.html
2025-08-17 10:31:00,"Meet the Marvelous Vanguard ETF With 57.7% of Its Portfolio Invested in the ""Magnificent Seven"" Stocks","The Vanguard Mega Cap Growth ETF offers investors exposure to the high-performing ""Magnificent Seven"" tech stocks, which have delivered exceptional returns driven by artificial intelligence innovations, representing 57.7% of the ETF's portfolio.",https://www.fool.com/investing/2025/08/17/meet-vanguard-etf-577-in-magnificent-seven-stocks/?source=iedfolrf0000001
2025-08-17 08:10:00,Can New AI-Powered Devices Propel Apple Stock Higher?,"Apple plans to launch innovative AI-powered smart home products by 2027, including a tabletop robot and smart speaker, aiming to reassert its position in the technology market after recent challenges with product launches and market performance.",https://www.fool.com/investing/2025/08/17/can-new-ai-powered-devices-propel-apple-stock-high/?source=iedfolrf0000001
2025-08-16 22:05:00,Where Will Apple Stock Be in 5 Years?,"Apple faces challenges with tariffs, iPhone sales, and AI competition, but maintains a strong ecosystem and potential for innovation. The stock may grow more slowly in the next five years compared to its historical performance.",https://www.fool.com/investing/2025/08/16/where-will-apple-stock-be-in-5-years/?source=iedfolrf0000001
2025-08-16 11:20:00,This Red-Hot Vanguard ETF Just Hit an All-Time High. Here's Why It's Still Worth Buying in August.,"The Vanguard Dividend Appreciation ETF has reached an all-time high, offering a unique investment approach that balances growth stocks and dividend-paying companies across multiple sectors, with a focus on earnings potential and dividend sustainability.",https://www.fool.com/investing/2025/08/16/red-hot-vanguard-etf-all-time-high-buy-august/?source=iedfolrf0000001
2025-08-16 11:09:00,"After Gaining $394 Billion in Market Cap in 3 Days, Is Apple Stock on Its Way to Joining Nvidia and Microsoft in the $4 Trillion Club?","Apple's stock surged 13% in three days, gaining $394 billion in market cap, driven by a new $100 billion manufacturing program and potential tariff exemptions. The company is working to integrate AI across its product suite and aims to potentially reach a $4 trillion market valuation by end of 2026.",https://www.fool.com/investing/2025/08/16/after-gaining-394-billion-in-market-cap-in-3-days/?source=iedfolrf0000001
2025-08-16 07:29:00,Berkshire: Strategic New Positions Signal Sector Confidence,"Warren Buffett's Berkshire Hathaway made strategic investments in healthcare and steel sectors, expanded homebuilding stock positions, and continued reducing Apple holdings in Q2 2025, signaling confidence in specific market segments.",https://www.investing.com/analysis/berkshire-strategic-new-positions-signal-sector-confidence-200665394
2025-08-16 07:12:00,Apple's 10% Stock Pop: Time to Invest in the Technology Giant Embracing America?,"Apple announced an increased investment of $600 billion in U.S. manufacturing over four years, spanning 50 states and impacting 450,000 jobs. While the stock initially popped, analysts suggest potential challenges with input costs and stagnating iPhone unit volumes.",https://www.fool.com/investing/2025/08/16/apples-10-stock-pop-time-to-invest-in-the-technolo/?source=iedfolrf0000001
2025-08-15 20:00:00,"AAPL INVESTOR ALERT: Bronstein, Gewirtz & Grossman LLC Announces that Apple Inc. Investors with Substantial Losses Have Opportunity to Lead Class Action Lawsuit","A class action lawsuit has been filed against Apple regarding alleged misrepresentations about AI-based Siri features for the iPhone 16, claiming false statements about product capabilities and potential business prospects.",https://www.globenewswire.com/news-release/2025/08/15/3134454/9788/en/AAPL-INVESTOR-ALERT-Bronstein-Gewirtz-Grossman-LLC-Announces-that-Apple-Inc-Investors-with-Substantial-Losses-Have-Opportunity-to-Lead-Class-Action-Lawsuit.html
2025-08-15 14:06:46,Warren Buffett Just Bought 6 Brand-New Stocks -- Here's Exactly What They Are,"During Q2, Berkshire Hathaway sold significant stakes in Apple, Bank of America, and T-Mobile, while simultaneously purchasing six new stocks, including UnitedHealth, Lennar, and D.R. Horton, potentially viewing them as undervalued opportunities.",https://www.fool.com/investing/2025/08/15/warren-buffett-just-bought-6-brand-new-stocks-here/?source=iedfolrf0000001
2025-08-15 11:30:00,Poised for Explosive Growth: Is Your Portfolio Ready for This ETF?,"The article explores the Vanguard Information Technology ETF (VGT), analyzing its composition, performance, and potential risks for investors interested in the technology sector, with a focus on top holdings like Nvidia, Microsoft, Apple, and Broadcom.",https://www.fool.com/investing/2025/08/15/poised-for-explosive-growth-is-your-portfolio/?source=iedfolrf0000001
2025-08-15 08:07:00,"1 Unstoppable Stock That Could Join Nvidia, Microsoft, and Apple in the $3 Trillion Club by 2027","Amazon is positioned to potentially reach a $3 trillion market valuation by 2027, driven by strong AWS cloud computing performance, AI innovations, and consistent earnings growth exceeding Wall Street expectations.",https://www.fool.com/investing/2025/08/15/1-stock-join-nvidia-microsoft-apple-3-trillion-202/?source=iedfolrf0000001
2025-08-15 08:05:00,Should You Buy Berkshire Hathaway Stock While It's Under $500? Warren Buffett Gives Investors a Clear Answer.,"Berkshire Hathaway's stock has dropped 12% from its record high, with Wall Street analysts believing it's undervalued. However, Warren Buffett has not repurchased shares in four quarters, suggesting the stock might not be attractively priced.",https://www.fool.com/investing/2025/08/15/buy-berkshire-stock-warren-buffett-sends-answer/?source=iedfolrf0000001
2025-08-14 12:30:00,Why the Google Antitrust Ruling Could Deal a Blow to Apple's Profits,"An upcoming antitrust ruling against Google could potentially eliminate Apple's lucrative search traffic revenue stream, which generates approximately $28 billion annually, potentially reducing Apple's earnings by up to 12%.",https://www.fool.com/investing/2025/08/14/google-antitrust-ruling-could-deal-a-blow-to-apple/?source=iedfolrf0000001
2025-08-14 08:27:00,1 Reason to Buy the Vanguard 500 Index (VFIAX) Index Fund Admiral Shares,"The article discusses the benefits of investing in the Vanguard 500 Index fund and S&P 500 ETF, highlighting their diversification, historical performance, and representation of major American companies.",https://www.fool.com/investing/2025/08/14/1-reason-to-buy-vfiax-vanguard-s-p-500-index-fund/?source=iedfolrf0000001
2025-08-13 22:23:16,Coherent Posts Record Q4 Revenue,"Coherent reported record fiscal 2025 revenue of $5.81 billion, up 23% year-over-year, and announced a $400 million aerospace and defense business divestiture to focus on photonics markets. The company secured a multiyear supply partnership with Apple and achieved a world-first six-inch indium phosphide wafer production line.",https://www.fool.com/data-news/2025/08/13/coherent-posts-record-q4-revenue/?source=iedfolrf0000001
2025-08-13 21:17:00,Record Buybacks and IPO Rush Point to Relentless Market Strength,"Despite concerns about tariffs and seasonal volatility, the U.S. market shows strong fundamentals with record stock buybacks, robust IPO activity, and impressive corporate earnings, suggesting continued investor confidence.",https://www.investing.com/analysis/record-buybacks-and-ipo-rush-point-to-relentless-market-strength-200665282
2025-08-13 19:13:00,The Most Shorted Stocks in the First Half of 2025,"A Hazeltree report analyzed short selling activities in the first half of 2025, revealing tech stocks were heavily shorted due to market volatility, with Apple, IBM, and Super Micro Computer being prominent targets.",https://www.investing.com/analysis/the-most-shorted-stocks-in-the-first-half-of-2025-200665267
2025-08-13 12:30:00,Nvidia and Microsoft Stocks Have Reached a $4 Trillion Valuation. Is Apple Next?,"Nvidia and Microsoft are leading the tech market's growth, entering the $4 trillion stock club, while Apple struggles with iPhone dependency and underwhelming AI developments. The AI market is projected to grow from $183 billion to $4.8 trillion by 2033.",https://www.fool.com/investing/2025/08/13/nvidia-and-microsoft-stocks-have-reached-a-4-trill/?source=iedfolrf0000001
2025-08-13 00:00:00,"Global Wearable Technology Market Set to Surpass $152.82 Billion by 2029: Trends, Growth Drivers, and Forecast","The global wearable technology market is projected to grow from $70.30 billion in 2024 to $152.82 billion by 2029, with a 16.8% CAGR driven by AI integration, consumer electronics demand, and increasing health monitoring applications.",https://www.globenewswire.com/news-release/2025/08/13/3132254/0/en/Global-Wearable-Technology-Market-Set-to-Surpass-152-82-Billion-by-2029-Trends-Growth-Drivers-and-Forecast.html
