publishedAt,title,description,article_url
2025-08-30 10:03:00,The Motley Fool Celebrates Warren Buffett on His 95th Birthday!,"The Motley Fool commemorates Warren Buffett's 95th birthday by sharing personal stories and insights about his investing philosophy, emphasizing his value investing approach, commitment to long-term investing, and philanthropic efforts.",https://www.fool.com/investing/2025/08/30/motley-fool-celebrates-buffett-95th-birthday/?source=iedfolrf0000001
2025-08-29 17:51:00,E-Mini S&P 500 Map Suggests Neutral-to-Bearish Outlook Ahead of Cycle Low,"E-Mini S&P 500 futures are trading at 6462.25, showing a bearish-to-neutral outlook with technical indicators suggesting potential mean reversion towards 6430-6418 in early September 2025.",https://www.investing.com/analysis/emini-sp-500-map-suggests-neutraltobearish-outlook-ahead-of-cycle-low-200666147
2025-08-29 15:18:00,Did Nvidia Meet Investors’ Expectations in Q2?,"Nvidia reported strong Q2 earnings with $46.7 billion revenue, beating analyst estimates, but experienced a slight stock selloff due to data center revenue marginally missing expectations and potential geopolitical challenges with China.",https://www.investing.com/analysis/did-nvidia-meet-investors-expectations-in-q2-200666142
2025-08-29 13:21:21,Centric Wealth Management Lightens Its UPS Holding,"Centric Wealth Management sold 40,712 UPS shares in Q2 2025, reducing its position but maintaining UPS as its top holding. The sale represents 1% of its reportable assets, with UPS still accounting for 6.2% of assets under management.",https://www.fool.com/coverage/filings/2025/08/29/centric-wealth-management-lightens-its-ups-holding/?source=iedfolrf0000001
2025-08-29 13:15:00,"Should You Buy the Low-Cost ETF With 62% Invested in ""Ten Titans"" Growth Stocks?","The Invesco S&P 500 Top 50 ETF offers concentrated exposure to the top 10 mega-cap growth stocks, with 62% invested in the ""Ten Titans"". While potentially lucrative, the ETF carries higher volatility risk due to its top-heavy composition.",https://www.fool.com/investing/2025/08/29/should-you-buy-the-low-cost-etf-with-ten-titans/?source=iedfolrf0000001
2025-08-29 11:30:00,"As Warren Buffett Continues to Trim Apple Stake, Should Investors Be Worried?","Berkshire Hathaway has reduced its Apple stake, but the position remains substantial at 280 million shares. Apple's services business is growing, with strong quarterly results and potential AI integration, suggesting the stock remains attractive despite the stake reduction.",https://www.fool.com/investing/2025/08/29/as-warren-buffett-continues-to-trim-apple-stake-sh/?source=iedfolrf0000001
2025-08-29 10:22:00,Here Are Billionaire Warren Buffett's 5 Biggest Stock Holdings,"Warren Buffett's investment portfolio is highly concentrated, with 63% of its market value invested in just five stocks. These stocks are industry leaders with strong cash flow, profitability, and competitive advantages.",https://www.fool.com/investing/2025/08/29/here-are-billionaire-warren-buffetts-5-biggest-sto/?source=iedfolrf0000001
2025-08-29 08:20:00,The Definitive Guide to Finding the Next 10-Bagger Stock,"The article explores strategies for identifying high-potential stocks by examining characteristics of successful companies like Amazon, Apple, Netflix, and Nvidia, focusing on product demand, market positioning, leadership, and sustainable growth potential.",https://www.fool.com/investing/2025/08/29/definitive-guide-finding-next-10-bagger-stock/?source=iedfolrf0000001
2025-08-29 08:15:00,Should Invesco QQQ Trust Be on Your Investing Radar Right Now?,"The Invesco QQQ Trust, an ETF tracking the Nasdaq-100 index, has consistently outperformed the S&P 500 over the past decade, delivering 482% returns by focusing on high-growth tech stocks like Nvidia, Microsoft, and Apple.",https://www.fool.com/investing/2025/08/29/should-qqq-be-on-your-investing-radar-right-now/?source=iedfolrf0000001
2025-08-29 07:06:00,"Warren Buffett Is Retiring in 4 Months, and His Successor May Sell This Core Holding Not Long Thereafter","Warren Buffett is retiring as CEO of Berkshire Hathaway by year-end, with Greg Abel taking over. While most core holdings are expected to remain unchanged, Apple stock might be sold due to stagnant growth and high valuation.",https://www.fool.com/investing/2025/08/29/warren-buffett-retire-4-months-sell-core-holding/?source=iedfolrf0000001
2025-08-28 13:28:53,Should Investors Buy Nvidia's 3% Post-Earnings Pullback?,"Nvidia reported impressive Q2 fiscal 2026 earnings with 56% year-over-year revenue growth to $46.7 billion, driven by AI GPU demand. Despite slightly missing data center revenue estimates and potential China market complications, the company remains optimistic about future AI infrastructure opportunities.",https://www.fool.com/investing/2025/08/28/should-investors-buy-nvidias-3-post-earnings/?source=iedfolrf0000001
2025-08-28 13:09:00,"If You'd Invested $1,000 in Apple Stock 5 Years Ago, Here's How Much You'd Have Today","An analysis of Apple's stock performance over the past five years reveals modest returns, slightly underperforming the S&P 500. The company is perceived as lagging in AI developments compared to other tech giants.",https://www.fool.com/investing/2025/08/28/if-you-invested-1000-in-apple-stock-5-years-ago/?source=iedfolrf0000001
2025-08-28 13:00:00,"Plus de contenu, plus d’économies : Rogers Xfinity regroupe Netflix, Disney+ et Apple TV+ dans un seul et unique forfait","Rogers introduces Diverti+ package combining Netflix, Disney+, and Apple TV+ into a single streaming bundle, offering over 30% monthly savings and integrated viewing experience.",https://www.globenewswire.com/news-release/2025/08/28/3140818/0/fr/Plus-de-contenu-plus-d-%C3%A9conomies-Rogers-Xfinity-regroupe-Netflix-Disney-et-Apple-TV-dans-un-seul-et-unique-forfait.html
2025-08-28 13:00:00,"Stream More, Save More: Rogers Xfinity Brings Netflix, Disney+ and Apple TV+ Together in One Plan","Rogers launched a new streaming bundle called StreamSaver, combining Netflix, Disney+, and Apple TV+ with over 30% monthly savings for customers in Western Canada, with plans to expand nationwide.",https://www.globenewswire.com/news-release/2025/08/28/3140818/0/en/Stream-More-Save-More-Rogers-Xfinity-Brings-Netflix-Disney-and-Apple-TV-Together-in-One-Plan.html
2025-08-28 10:32:00,Want AI Exposure Without the Volatility? This ETF Might Be the Smartest Play,"The Invesco QQQ Trust ETF offers investors a low-risk way to gain exposure to AI-driven technology stocks, with an impressive 18.5% average annual return over the past decade and a low 0.2% expense ratio.",https://www.fool.com/investing/2025/08/28/want-ai-exposure-without-the-volatility-this-etf/?source=iedfolrf0000001
2025-08-28 10:22:00,12 Stocks Warren Buffett's Berkshire Hathaway Has Been Loading Up On in 2025,"Warren Buffett's Berkshire Hathaway was a net seller of stocks in the first half of 2025, primarily due to large sales of Apple and Bank of America. However, the company also added six new stock positions and increased shares in six existing investments during this period.",https://www.fool.com/investing/2025/08/28/12-stocks-warren-buffetts-berkshire-hathaway-has-b/?source=iedfolrf0000001
2025-08-28 08:17:00,"Warren Buffett Says Buy This Index Fund, and Here's How It Could Turn $500 Per Month Into $1 Million","Warren Buffett recommends investing in a low-cost S&P 500 index fund, specifically the Vanguard S&P 500 ETF, as a strategy for long-term wealth building. By consistently investing $500 monthly, investors could potentially accumulate $1 million in under 30 years, benefiting from the index's historical 10.5% annual return and diversification across high-quality companies.",https://www.fool.com/investing/2025/08/28/warren-buffett-buy-index-fund-500-month-1-million/?source=iedfolrf0000001
2025-08-27 21:14:00,Buffett Indicator at 213% Suggests US Stocks Are Deep Into Overvalued Territory,"The Buffett Indicator, which measures total market capitalization relative to GDP, is at 213%, signaling significant stock market overvaluation. This is the highest level since 1980, surpassing even the dotcom bubble, and suggests potential market risks for investors.",https://www.investing.com/analysis/buffett-indicator-at-213-suggests-us-stocks-are-deep-into-overvalued-territory-200666004
2025-08-27 16:00:32,Apple Stock To Get Boost From 'Awe Dropping' iPhone 17 Event? Not So Fast Says Past History,"Apple is set to host its iPhone 17 event on September 9, 2025, featuring new iPhone models with potential AI tools, slim design, and expected pricing between $800-$1,250. The event's impact on Apple's stock performance is uncertain, with past events showing mixed trading results.",https://www.benzinga.com/trading-ideas/previews/25/08/47363134/apple-stock-to-get-boost-from-awe-dropping-iphone-17-event-not-so-fast-says-past-history
2025-08-27 15:29:00,MP Materials: How One Move Redefined the US Magnet Supply Chain,"MP Materials transformed its business model by developing domestic rare earth oxide processing capabilities, securing strategic partnerships with the US Department of Defense and Apple, and reducing dependency on Chinese processors.",https://www.investing.com/analysis/mp-materials-how-one-move-redefined-the-us-magnet-supply-chain-200665993
2025-08-27 12:15:00,The Smartest Growth ETF to Buy With $100 Right Now,"The article discusses the Vanguard Russell 1000 Growth ETF as an attractive investment option, highlighting its low-cost, diversified approach to tracking large-cap U.S. stocks with strong growth potential.",https://www.fool.com/investing/2025/08/27/the-smartest-growth-etf-to-buy-with-100-right-now/?source=iedfolrf0000001
2025-08-27 12:00:00,"ZAGG Introduces the Slim Book mini Keyboard Case – Compact, Professional, and Built for iPad mini (A17 Pro & 6th Generations)","ZAGG launched a new Bluetooth keyboard case for iPad mini (A17 Pro & 6th Gen), offering a compact, professional accessory with detachable keyboard, multiple viewing angles, and durable protection for mobile professionals and students.",https://www.globenewswire.com/news-release/2025/08/27/3139930/24609/en/ZAGG-Introduces-the-Slim-Book-mini-Keyboard-Case-Compact-Professional-and-Built-for-iPad-mini-A17-Pro-6th-Generations.html
2025-08-27 06:01:00,Steepening Yield Curve Signals Big Moves in Long-Term Treasuries,"The yield curve is steepening, with the 30-year Treasury rate rising and potentially preparing for significant market movements. The market is anticipating Nvidia's earnings report, which could impact market volatility.",https://www.investing.com/analysis/steepening-yield-curve-signals-big-moves-in-longterm-treasuries-200665941
2025-08-26 18:35:00,Nasdaq 100 Rally Framed as Wave-C Advance Within Long-Term Structure,"The article analyzes the Nasdaq 100 index's potential Elliott Wave trajectory since the March 2020 COVID-19 low, suggesting the index is currently in a third wave of an ending diagonal pattern with potential to reach around 28,000 in the coming years.",https://www.investing.com/analysis/nasdaq-100-rally-framed-as-wavec-advance-within-longterm-structure-200665929
2025-08-26 07:02:00,"Prediction: This Unstoppable Stock Will Join Nvidia, Microsoft, and Apple in the $3 Trillion Club Before 2028","Alphabet is predicted to reach a $3 trillion market cap by 2028, driven by strong performance in search, digital advertising, cloud computing, and AI technologies. Despite recent legal challenges, the company shows robust growth potential and competitive advantages.",https://www.fool.com/investing/2025/08/26/prediction-this-unstoppable-stock-will-join-nvidia/?source=iedfolrf0000001
2025-08-25 18:18:00,E-Mini S&P 500 Rally Tests Gann and Fibonacci Resistance Into August Cycle Crest,"The E-mini S&P 500 futures are experiencing a rally after a sharp reversal, testing key resistance levels around 6,478-6,531. Technical analysis suggests potential market turning points in late August and early September based on Gann cycle projections.",https://www.investing.com/analysis/emini-sp-500-rally-tests-gann-and-fibonacci-resistance-into-august-cycle-crest-200665855
2025-08-25 17:04:00,The Market’s Built-In Safety Net Could Vanish If Passive Flows Reverse,"The article warns about potential market risks from passive investing, highlighting how automatic ETF flows have created an artificial market safety net that could collapse if investment patterns change, potentially exposing retail investors to significant losses.",https://www.investing.com/analysis/the-markets-builtin-safety-net-could-vanish-if-passive-flows-reverse-200665831
2025-08-25 15:24:00,Exercising Fed Put Could Fuel Stock Market Melt-Up,"The article discusses potential stock market dynamics if the Federal Reserve cuts rates in September, suggesting a possible market 'melt-up' driven by investor expectations, while warning about potential subsequent market volatility.",https://www.investing.com/analysis/exercising-fed-put-could-fuel-stock-market-meltup-200665797
2025-08-25 11:09:00,These Little-Known Funds Let You Skim 9% of Corporate Profits,"The article discusses how corporations are generating significant profits but offering low dividend yields, and suggests using high-yield closed-end funds (CEFs) to capture corporate earnings through bond investments.",https://www.investing.com/analysis/these-littleknown-funds-let-you-skim-9-of-corporate-profits-200665827
2025-08-25 09:27:00,"If You'd Invested $1,000 in SoFi Technologies (SOFI) Stock 3 Years Ago, Here's How Much You'd Have Today. (Spoiler: Wow.)","SoFi Technologies has shown impressive growth, with a $1,000 investment three years ago now worth $3,824, representing a 56% average annual gain. The fintech company offers diverse financial services targeting millennials and has been expanding its membership and revenue.",https://www.fool.com/investing/2025/08/25/if-you-invested-in-sofi-technologies-3-years-ago/?source=iedfolrf0000001
2025-08-25 08:06:00,Micro-Cap and Emerging Market Stocks Light Up the Rotation Chart,"Market analysis reveals potential bullish rotation with emerging strength in micro-cap and emerging market stocks, while cautioning about potential September volatility and market risks.",https://www.investing.com/analysis/microcap-and-emerging-market-stocks-light-up-the-rotation-chart-200665795
2025-08-25 07:13:00,Stocks Week Ahead: Will the S&P 500 Rally Extend Into the New Week?,"The article discusses market volatility following Jackson Hole and Fed Chair Powell's speech, suggesting that market movements are more related to event risk passing than substantive policy changes. The author emphasizes that the Fed remains committed to its 2% inflation target and is data-dependent.",https://www.investing.com/analysis/volatility-collapse-drives-shortlived-rally-in-stocks-and-bonds-200665792
2025-08-24 23:12:00,"Prediction: All ""Ten Titans"" Stocks Will Surpass $1 Trillion in Market Cap by 2030","The article explores the potential of Oracle and Netflix to reach $1 trillion market capitalization by 2030, analyzing their growth strategies, investments, and challenges in the competitive tech landscape.",https://www.fool.com/investing/2025/08/24/prediction-ten-titans-2030-trillion-market-cap/?source=iedfolrf0000001
2025-08-24 23:06:00,"The Smartest Growth Stock to Buy With $1,000 Right Now","Alphabet is positioned as an attractive investment due to its strong performance in AI, cloud computing, streaming, and autonomous vehicle technologies. Despite facing potential legal challenges, the company has shown robust financial results and growth across multiple segments.",https://www.fool.com/investing/2025/08/24/the-smartest-growth-stock-to-buy-with-1000/?source=iedfolrf0000001
2025-08-24 11:24:00,"Here's How Many Shares of Apple Stock You'd Need for $10,000 in Yearly Dividends","Apple continues to demonstrate strong financial performance, paying quarterly dividends and aggressively repurchasing shares, with a net profit margin of 24.9% and significant free cash flow.",https://www.fool.com/investing/2025/08/24/how-many-shares-apple-stock-need-10000-dividends/?source=iedfolrf0000001
2025-08-24 10:25:00,"The Best Steel Stock to Invest $10,000 in Right Now (According to Berkshire Hathaway)","Berkshire Hathaway recently invested in Nucor, a leading North American steelmaker known for its flexible electric arc mini-mills and consistent dividend growth. Despite current industry softness, the stock presents a potential long-term investment opportunity during a cyclical industry trough.",https://www.fool.com/investing/2025/08/24/the-best-steel-stock-to-invest-10000-in-right-now/?source=iedfolrf0000001
2025-08-24 08:19:00,This Top Vanguard Fund Has Doubled in 5 Years and Is an Investment You Can Hold Forever,"The Vanguard Russell 1000 Growth Index Fund has risen 110% in five years, offering investors a tech-focused ETF with strong growth potential and low fees. The fund provides diversification across sectors while maintaining a significant tech portfolio.",https://www.fool.com/investing/2025/08/24/this-top-vanguard-fund-has-doubled-in-5-years-and/?source=iedfolrf0000001
2025-08-23 20:05:00,Is the Vanguard Mega Cap ETF the Simplest Way to Invest in the Top S&P 500 Stocks?,"The Vanguard Mega Cap ETF offers a concentrated investment in the largest S&P 500 stocks, with a slightly higher expense ratio but potentially better performance, making it an attractive option for investors seeking exposure to top-tier companies.",https://www.fool.com/investing/2025/08/23/vanguard-mega-cap-etf-top-sp-500-stocks/?source=iedfolrf0000001
2025-08-23 14:10:00,Warren Buffett Is Selling Apple and Bank of America and Piling Into This Beaten Down Value Stock Instead,"Warren Buffett is selling shares of Apple and Bank of America while investing approximately $2 billion in UnitedHealth Group, a healthcare stock that has been significantly undervalued despite facing challenges.",https://www.fool.com/investing/2025/08/23/warren-buffett-is-selling-apple-and-bank-of-americ/?source=iedfolrf0000001
2025-08-23 13:35:00,Is MP Materials Overvalued After Its 450% Surge?,"MP Materials, a rare-earth metals producer in the United States, has seen significant stock growth due to a $400 million U.S. government investment. However, the company remains a money-losing startup with high valuation risks and uncertain long-term profitability.",https://www.fool.com/investing/2025/08/23/is-mp-materials-overvalued-after-its-450-surge/?source=iedfolrf0000001
2025-08-23 12:30:00,Is Berkshire Hathaway Still a Millionaire-Maker Stock?,"Warren Buffett is stepping down as CEO of Berkshire Hathaway, marking a significant transition for the trillion-dollar conglomerate. While the company has historically delivered exceptional returns, its massive size may limit future growth potential, and the new CEO will face challenges in maintaining the company's investment strategy.",https://www.fool.com/investing/2025/08/23/is-berkshire-hathaway-a-millionaire-maker-stock/?source=iedfolrf0000001
2025-08-23 09:44:00,6 Moving Averages Every Serious Trader Uses,"The article discusses six key moving averages (5-day, 10-day, 20-day, 50-day, 100-day, and 200-day) that traders use to analyze market trends, identify momentum shifts, and make trading decisions across different financial instruments.",https://www.investing.com/analysis/6-moving-averages-every-serious-trader-uses-200665532
2025-08-23 09:30:00,Warren Buffett Is Selling Apple Stock Again. Should You Follow His Lead?,"Warren Buffett is steadily selling Apple stock due to its high valuation and slow growth, potentially preparing Berkshire Hathaway's investment portfolio for his successor Greg Abel.",https://www.fool.com/investing/2025/08/23/warren-buffett-is-selling-apple-stock-again-should/?source=iedfolrf0000001
2025-08-23 09:15:00,Billionaire Stanley Druckenmiller Just Bought More of My Favorite Artificial Intelligence (AI) Pick,"Billionaire investor Stanley Druckenmiller increased his stake in Taiwan Semiconductor Manufacturing (TSMC) by 28%, signaling confidence in the company's AI and chip manufacturing potential. TSMC is well-positioned in the AI market with innovative chip technologies and strategic investments.",https://www.fool.com/investing/2025/08/23/billionaire-stanley-druckenmiller-just-bought-more/?source=iedfolrf0000001
2025-08-23 08:00:00,Volume Price Analysis Anomalies In The Markets Right Now,"An analysis of current market volume and price trends, highlighting potential anomalies and market movements across various financial instruments.",https://www.investing.com/analysis/volume-price-analysis-anomalies-in-the-markets-right-now-200665421
2025-08-23 00:30:00,"Prediction: This Unstoppable Stock Will Join Nvidia, Microsoft, and Apple in the $3 Trillion Club Before 2029","Meta Platforms is predicted to potentially reach a $3 trillion market cap by 2029, driven by its significant investments in AI technology, strong advertising revenue, and massive user base of over 3 billion daily active users.",https://www.fool.com/investing/2025/08/22/prediction-this-unstoppable-stock-will-join-nvidia/?source=iedfolrf0000001
2025-08-22 19:12:47,Why Alphabet Stock Popped Friday,Apple is reportedly in talks with Alphabet to use Google's Gemini AI to redesign and enhance its Siri voice assistant after experiencing engineering setbacks with its previous AI integration plans.,https://www.fool.com/investing/2025/08/22/why-alphabet-stock-popped-friday/?source=iedfolrf0000001
2025-08-22 10:30:00,3 Cheap AI Stocks You Can Buy Now and Hold Long-Term,"Alphabet has strategically divested its entire stake in an unspecified AI stock and invested in a $32 billion startup, signaling potential shifts in its technology investment strategy.",https://www.fool.com/investing/2025/08/22/3-cheap-ai-stocks-you-can-buy-now-and-hold-long-te/?source=iedfolrf0000001
2025-08-22 10:15:00,"The Smartest Growth Stock to Buy With $2,000 Right Now","Arm Holdings is a chip design company experiencing significant growth potential in data center and AI processor markets, offering power-efficient technology that is increasingly critical for modern computing needs.",https://www.fool.com/investing/2025/08/22/the-smartest-growth-stock-to-buy-with-2000-now/?source=iedfolrf0000001
2025-08-21 20:06:00,E-Mini S&P 500 Futures Signal Double Top as 360-Day Cycle Nears Crest,"Technical analysis suggests the E-Mini S&P 500 Futures are showing a potential bearish double top pattern at the 6500 level, with indicators pointing to a possible market decline toward 6330-6240 by late September 2025.",https://www.investing.com/analysis/emini-sp-500-futures-signal-double-top-as-360day-cycle-nears-crest-200665700
2025-08-21 17:00:00,"MiLi’s Back to School Sale – 20% Off Sitewide with MiTag Duo, LiTag Duo, and MiCard Duo","MiLi introduces a new line of smart tracking devices (MiTag Duo, LiTag Duo, MiCard Duo) that are compatible with both Apple and Google platforms, offering cross-ecosystem tracking solutions for students and professionals.",https://www.globenewswire.com/news-release/2025/08/21/3137389/0/en/MiLi-s-Back-to-School-Sale-20-Off-Sitewide-with-MiTag-Duo-LiTag-Duo-and-MiCard-Duo.html
2025-08-21 13:20:00,S&P 500: Is a Deeper Correction Ahead?,"The S&P 500 is experiencing potential market weakness ahead of the Jackson Hole symposium, with investors cautious about potential hawkish comments from Fed Chair Powell. Market sentiment remains relatively bearish, with low volatility and concerns about potential correction.",https://www.investing.com/analysis/sp-500-is-a-deeper-correction-ahead-200665680
2025-08-21 11:35:00,Dow Jones Bulls Await Fed Catalyst to Push Past 45K Barrier,"Dow Jones investors are anticipating Fed Chair Powell's Jackson Hole speech as a potential catalyst to break through the 45,000 resistance level. Tech stocks have experienced recent weakness, but sector rotation in financials, energy, and consumer sectors may help cushion market volatility.",https://www.investing.com/analysis/dow-jones-bulls-await-fed-catalyst-to-push-past-45k-barrier-200665670
2025-08-21 10:05:00,Here's Why I'm Not Buying the Dip in Nvidia's Stock,"Nvidia reported extraordinary quarterly results with $44.1 billion revenue, up 69% year-over-year, but an analyst warns of potential risks due to high valuation, tough future comparisons, and potential competitive challenges in the AI chip market.",https://www.fool.com/investing/2025/08/21/heres-why-im-not-buying-the-dip-in-nvidias-stock/?source=iedfolrf0000001
2025-08-21 09:30:00,"1 Unstoppable Stock That Could Join Nvidia, Microsoft, and Apple in the $3 Trillion Club","Alphabet (Google) is positioned to potentially join the $3 trillion valuation club, demonstrating strong performance in search and cloud computing despite AI disruption fears. The company's robust revenue growth, cheap valuation, and strategic AI integration make it an attractive investment.",https://www.fool.com/investing/2025/08/21/1-unstoppable-stock-that-could-join-nvidia-microso/?source=iedfolrf0000001
2025-08-21 09:15:00,Prediction: This Supercharged Artificial Intelligence (AI) Stock Will Be Worth More Than Apple and Microsoft Combined by 2030,"Nvidia is projected to potentially reach a market capitalization of $7.3 trillion by 2030, surpassing the combined value of Apple and Microsoft, driven by its dominance in AI GPU technology and increasing data center capital expenditures.",https://www.fool.com/investing/2025/08/21/prediction-this-supercharged-artificial-intelligen/?source=iedfolrf0000001
